### ISSUE TITLE
F5 Trap messages not having `event` varbind metrics converted from OID to string name

### ISSUE THREAD

**Issue by jryburn** [kentik/ktranslate#740]

**Comment by i3149** [comment]
I'm having a hard to reproducing this bug. When I use the provided python script I get:
```json
[
  {
    "instrumentation.name": "netflow-events",
    "TrapOID": ".1.3.6.1.4.1.3375.2.4.0.10",
    "src_addr": "127.0.0.1",
    "collector.name": "ktranslate",
    "node_name": "/Common/100.84.2.109",
    "service_port": "80",
    "eventType": "KSnmpTrap",
    "provider": "kentik-trap-device",
    "instrumentation.provider": "kentik",
    "message": "Pool /Common/http_las.fml.prod.eleadcrm.com_80_pool member /Common/100.84.2.109:80 monitor status down. [ /Common/http_head_evo2-releaseinfo_200: down, /Common/http_release_updown: checking; last error: /Common/http_head_evo2-releaseinfo_200: Response Code: 200 (OK) @2024/08/14 09:10:15. ] [ was up for 0hr:3mins:36sec ]",
    "TrapName": "bigipServiceDown",
    "device_name": "127.0.0.1"
  }
]
```

Which I think is correct? Can you tell me what's missing here? 

One thing that comes to mind is you might have an older ktrans container which didn't get correct f5 yaml?

**Comment by ASchneider-GitHub** [comment]
The primary issue (at least to my understanding of Ktranslate) is that the varbinds that are collected as `events` in the profile are supposed to have the varbind event OID translated into the event name before getting ingested as a metric. I could be totally off-base, but for example we have this payload from NRDB:
```
[
  {
    "results": [
      {
        "events": [
          {
            ".1.3.6.1.2.1.1.3.0": 335318124,
            ".1.3.6.1.4.1.3375.2.4.1.1": "Pool /Common/POD37-b-_Pool member /Common/100.84.2.37:80 monitor status up. [ /Common/http_evo2_F5test: up, /Common/http_release_updown: up ]  [ was down for 0hr:1min:52sec ]",
            ".1.3.6.1.4.1.3375.2.4.1.2": "/Common/100.84.2.37",
            ".1.3.6.1.4.1.3375.2.4.1.3": "80",
            ".1.3.6.1.6.3.1.1.4.3.0": ".1.3.6.1.4.1.3375.2.4",
            "TrapOID": ".1.3.6.1.4.1.3375.2.4.0.11",
[...]
          }
        ]
      }
    ]
  }
]
```

but the metric names for the varbinds are the actual OID instead of looking like this:
```
[
  {
    "results": [
      {
        "events": [
          {
            ".1.3.6.1.2.1.1.3.0": 335318124,
            "message": "Pool /Common/POD37-b-_Pool member /Common/100.84.2.37:80 monitor status up. [ /Common/http_evo2_F5test: up, /Common/http_release_updown: up ]  [ was down for 0hr:1min:52sec ]",
            "node_name": "/Common/100.84.2.37",
            "service_port": "80",
            ".1.3.6.1.6.3.1.1.4.3.0": ".1.3.6.1.4.1.3375.2.4",
            "TrapOID": ".1.3.6.1.4.1.3375.2.4.0.11",
[...]
          }
        ]
      }
    ]
  }
]
```

The example that you provided does have that translation between varbind OID and metric name present. How did you create the JSON output you provided?

**Comment by i3149** [comment]
Can you try this and see if you get the same output:

```
docker pull kentik/ktranslate:v2
docker run -ti --rm --net=host -v `pwd`/trap.yaml:/trap.yaml kentik/ktranslate:v2 -snmp trap.yaml
```

Should see 

```json
[{"src_geo":"Private IP","src_as_name":"Private IP","node_name":"/Common/100.84.2.109","TrapName":"bigipServiceDown","provider":"kentik-trap-device","eventType":"KSnmpTrap","service_port":"80","message":"Pool /Common/http_las.fml.prod.eleadcrm.com_80_pool member /Common/100.84.2.109:80 monitor status down. [ /Common/http_head_evo2-releaseinfo_200: down, /Common/http_release_updown: checking; last error: /Common/http_head_evo2-releaseinfo_200: Response Code: 200 (OK) @2024/08/14 09:10:15. ] [ was up for 0hr:3mins:36sec ]","sysUpTimeInstance":257116481,"device_name":"192.168.0.100","collector.name":"ktranslate","instrumentation.provider":"kentik","TrapOID":".1.3.6.1.4.1.3375.2.4.0.10","instrumentation.name":"netflow-events","src_addr":"192.168.0.100"}]
```

This is using the default json format which just dumps what is given to stdout.

**Comment by ASchneider-GitHub** [comment]
Running the container with the command provided does show a successful launch:
```
aschneider@ubuntu-server:~$ docker run -ti --rm --net=host -v `pwd`/traps-base.yaml:/trap.yaml kentik/ktranslate:v2 -snmp trap.yaml
2024-08-26T17:07:30.215 ktranslate/ [Info]  version kt-2024-08-23-10532091716 starting
2024-08-26T17:07:30.215 ktranslate/ [Info]  olly: disabled
2024-08-26T17:07:30.215 ktranslate/ [Info]  Setting metrics: none
2024-08-26T17:07:30.282 ktranslate/ [Info] KTranslate Turning on 1 processing threads
2024-08-26T17:07:30.285 ktranslate/ [Info] KTranslate Loaded 128 custom mappings
2024-08-26T17:07:30.288 ktranslate/ [Info] KTranslate Loaded 23 udr and 23 subtype mappings with 532 udrs total
2024-08-26T17:07:30.290 ktranslate/ [Info] KTranslate Using sink stdout
2024-08-26T17:07:30.291 ktranslate/ [Info] KTranslate Running -- Version kt-2024-08-23-10532091716; Build Fri Aug 23 20:43:30 UTC 2024
2024-08-26T17:07:30.291 ktranslate/ [Info] KTranslate CLI: [ktranslate -listen off -mapping /etc/ktranslate/config.json -geo /etc/ktranslate/GeoLite2-Country.mmdb -udrs /etc/ktranslate/udr.csv -api_devices /etc/ktranslate/devices.json -asn /etc/ktranslate/GeoLite2-ASN.mmdb -log_level info -snmp trap.yaml]
2024-08-26T17:07:30.298 ktranslate/ [Info] baseserver.metaserver Listening on 127.0.0.1:41309
2024-08-26T17:07:30.298 ktranslate/ [Info] KTranslate API server running 2 devices
2024-08-26T17:07:30.298 ktranslate/ [Info] KTranslate Loaded 2 Kentik devices via local file
2024-08-26T17:07:30.299 ktranslate/ [Info] KTranslate Client SNMP: Running SNMP interface polling, loading config from trap.yaml
2024-08-26T17:07:30.300 ktranslate/ [Info] KTranslate Setting timeout to 30s
2024-08-26T17:07:30.300 ktranslate/ [Info] KTranslate Setting retry to 0
2024-08-26T17:07:30.300 ktranslate/ [Info] KTranslate Client SNMP: Running SNMP Trap listener on 0.0.0.0:1620
2024-08-26T17:07:30.300 ktranslate/ [Info] KTranslate Trap listener setup with version v2c on 0.0.0.0:1620. DropUndefined: false
2024-08-26T17:07:30.300 ktranslate/ [Info] stdoutSink Receiving logs...
2024-08-26T17:07:30.300 ktranslate/ [Info] KTranslate monitorInput 0 Starting
2024-08-26T17:07:30.302 ktranslate/ [Info] KTranslate System running with format flat_json, compression none, max flows: 10000, sample rate 1:1 after 1
2024-08-26T17:07:30.302 ktranslate/ [Info] KTranslate sendToSinks base Online
2024-08-26T17:07:30.302 ktranslate/ [Info] KTranslate monitorMetricsInput Starting
2024-08-26T17:07:30.303 ktranslate/ [Info] KTranslate Turning off HTTP server.
2024-08-26T17:07:30.305 ktranslate/ [Info] KTranslate do sendToKTranslate Starting
2024-08-26T17:07:30.306 ktranslate/ [Info] KTranslate monitorAlpha 0 Online
```

but after that, no logs are written from the container. I ran the script again to generate the Trap message, and I can see it on `tcpdump`:
```
aschneider@ubuntu-server:~$ sudo tcpdump -i any -U -n -s0 src 10.0.0.2 and udp
tcpdump: data link type LINUX_SLL2
tcpdump: verbose output suppressed, use -v[v]... for full protocol decode
listening on any, link-type LINUX_SLL2 (Linux cooked v2), snapshot length 262144 bytes

17:10:25.455593 ens18 In  IP 10.0.0.2.62555 > 10.0.1.1.162:  C="cdk" V2Trap(526)  .1.3.6.1.2.1.1.3.0=257116481 .1.3.6.1.6.3.1.1.4.1.0=.1.3.6.1.6.3.1.1.5.1 .1.3.6.1.2.1.1.3.0=257116481 .1.3.6.1.6.3.1.1.4.1.0=.1.3.6.1.4.1.3375.2.4.0.10 .1.3.6.1.4.1.3375.2.4.1.1="Pool /Common/http_las.fml.prod.eleadcrm.com_80_pool member /Common/100.84.2.109:80 monitor status down. [ /Common/http_head_evo2-releaseinfo_200: down, /Common/http_release_updown: checking; last error: /Common/http_head_evo2-releaseinfo_200: Response Code: 200 (OK) @2024/08/14 09:10:15. ] [ was up for 0hr:3mins:36sec ]" .1.3.6.1.4.1.3375.2.4.1.2="/Common/100.84.2.109" .1.3.6.1.4.1.3375.2.4.1.3="80" .1.3.6.1.6.3.1.1.4.3.0=.1.3.6.1.4.1.3375.2.4
```

but it never appears in the Docker logs for some reason. Does the container typically output logs when "successfully" ingesting data?

**Comment by i3149** [comment]
That sounds like a firewall in the way. Remember that tcpdump runs before iptables and so doesn't show dropped packets, rather all packets. Can you go back to how you were originally running the docker container and do it this way? However that was it was getting the packets through. Just make sure to pull a new image and take out all the flags except for `-snmp`

**Comment by ASchneider-GitHub** [comment]
Command to launch the container:
```
docker run -d --name ktranslate-debug-level-container --restart unless-stopped --pull=always -p 162:1620/udp \
-v `pwd`/traps-base.yaml:/snmp-base.yaml \
kentik/ktranslate:v2 \
  -metrics=jchf \
  -tee_logs=true \
  -service_name=debug-level-test \
  -log_level=debug
  ```
 
`tcpdump` from outside the container:
```
aschneider@ubuntu-server:~$ sudo tcpdump -i any -U -n -s0 port 162 and udp
[sudo] password for aschneider: 
tcpdump: data link type LINUX_SLL2
tcpdump: verbose output suppressed, use -v[v]... for full protocol decode
listening on any, link-type LINUX_SLL2 (Linux cooked v2), snapshot length 262144 bytes
22:47:22.223115 ens18 In  IP 10.0.0.2.62550 > 10.0.1.1.162:  C="cdk" V2Trap(526)  .1.3.6.1.2.1.1.3.0=257116481 .1.3.6.1.6.3.1.1.4.1.0=.1.3.6.1.6.3.1.1.5.1 .1.3.6.1.2.1.1.3.0=257116481 .1.3.6.1.6.3.1.1.4.1.0=.1.3.6.1.4.1.3375.2.4.0.10 .1.3.6.1.4.1.3375.2.4.1.1="Pool /Common/http_las.fml.prod.eleadcrm.com_80_pool member /Common/100.84.2.109:80 monitor status down. [ /Common/http_head_evo2-releaseinfo_200: down, /Common/http_release_updown: checking; last error: /Common/http_head_evo2-releaseinfo_200: Response Code: 200 (OK) @2024/08/14 09:10:15. ] [ was up for 0hr:3mins:36sec ]" .1.3.6.1.4.1.3375.2.4.1.2="/Common/100.84.2.109" .1.3.6.1.4.1.3375.2.4.1.3="80" .1.3.6.1.6.3.1.1.4.3.0=.1.3.6.1.4.1.3375.2.4
```

  `tcpdump` from inside the container:
```
aschneider@ubuntu-server:~$ docker exec -u 0 -it 4f97378c5db2 /bin/sh
/ # apk add tcpdump
fetch https://dl-cdn.alpinelinux.org/alpine/v3.17/main/x86_64/APKINDEX.tar.gz
fetch https://dl-cdn.alpinelinux.org/alpine/v3.17/community/x86_64/APKINDEX.tar.gz
(1/1) Installing tcpdump (4.99.4-r0)
Executing busybox-1.35.0-r31.trigger
OK: 145 MiB in 45 packages
/ # tcpdump -i any -U -n -s0 port 1620 and udp
tcpdump: data link type LINUX_SLL2
tcpdump: verbose output suppressed, use -v[v]... for full protocol decode
listening on any, link-type LINUX_SLL2 (Linux cooked v2), snapshot length 262144 bytes
22:47:22.223555 eth0  In  IP 10.0.0.2.62550 > 172.17.0.2.1620: UDP, length 542
```

Logs from Docker container:
```
aschneider@ubuntu-server:~$ docker logs -f 4f97378c5db2
2024-08-26T22:45:47.427 ktranslate/debug-level-test [Info] debug-level-test version kt-2024-08-23-10532091716 starting
2024-08-26T22:45:47.427 ktranslate/debug-level-test [Info] debug-level-test olly: disabled
2024-08-26T22:45:47.427 ktranslate/debug-level-test [Info] debug-level-test Setting metrics: jchf
2024-08-26T22:45:47.427 ktranslate/debug-level-test [Info] debug-level-test Metrics: Connecting jchf
2024-08-26T22:45:47.471 ktranslate/debug-level-test [Info] KTranslate Turning on 1 processing threads
2024-08-26T22:45:47.473 ktranslate/debug-level-test [Info] KTranslate Loaded 128 custom mappings
2024-08-26T22:45:47.476 ktranslate/debug-level-test [Info] KTranslate Loaded 23 udr and 23 subtype mappings with 532 udrs total
2024-08-26T22:45:47.477 ktranslate/debug-level-test [Info] KTranslate Using sink stdout
2024-08-26T22:45:47.477 ktranslate/debug-level-test [Info] KTranslate Running -- Version kt-2024-08-23-10532091716; Build Fri Aug 23 20:43:30 UTC 2024
2024-08-26T22:45:47.477 ktranslate/debug-level-test [Info] KTranslate CLI: [ktranslate -listen off -mapping /etc/ktranslate/config.json -geo /etc/ktranslate/GeoLite2-Country.mmdb -udrs /etc/ktranslate/udr.csv -api_devices /etc/ktranslate/devices.json -asn /etc/ktranslate/GeoLite2-ASN.mmdb -log_level info -metrics=jchf -tee_logs=true -service_name=debug-level-test -log_level=debug]
2024-08-26T22:45:47.427 ktranslate/debug-level-test [Info] debug-level-test version kt-2024-08-23-10532091716 starting
2024-08-26T22:45:47.427 ktranslate/debug-level-test [Info] debug-level-test olly: disabled
2024-08-26T22:45:47.427 ktranslate/debug-level-test [Info] debug-level-test Setting metrics: jchf
2024-08-26T22:45:47.427 ktranslate/debug-level-test [Info] debug-level-test Metrics: Connecting jchf
2024-08-26T22:45:47.471 ktranslate/debug-level-test [Info] KTranslate Turning on 1 processing threads
2024-08-26T22:45:47.473 ktranslate/debug-level-test [Info] KTranslate Loaded 128 custom mappings
2024-08-26T22:45:47.476 ktranslate/debug-level-test [Info] KTranslate Loaded 23 udr and 23 subtype mappings with 532 udrs total
2024-08-26T22:45:47.477 ktranslate/debug-level-test [Info] KTranslate Using sink stdout
2024-08-26T22:45:47.477 ktranslate/debug-level-test [Info] KTranslate Running -- Version kt-2024-08-23-10532091716; Build Fri Aug 23 20:43:30 UTC 2024
2024-08-26T22:45:47.477 ktranslate/debug-level-test [Info] KTranslate CLI: [ktranslate -listen off -mapping /etc/ktranslate/config.json -geo /etc/ktranslate/GeoLite2-Country.mmdb -udrs /etc/ktranslate/udr.csv -api_devices /etc/ktranslate/devices.json -asn /etc/ktranslate/GeoLite2-ASN.mmdb -log_level info -metrics=jchf -tee_logs=true -service_name=debug-level-test -log_level=debug]
2024-08-26T22:45:47.482 ktranslate/debug-level-test [Info] KTranslate API server running 1 devices
2024-08-26T22:45:47.482 ktranslate/debug-level-test [Info] KTranslate API server running 1 devices
2024-08-26T22:45:47.482 ktranslate/debug-level-test [Info] KTranslate Loaded 1 Kentik devices via local file
2024-08-26T22:45:47.482 ktranslate/debug-level-test [Info] KTranslate System running with format flat_json, compression none, max flows: 10000, sample rate 1:1 after 1
2024-08-26T22:45:47.482 ktranslate/debug-level-test [Info] KTranslate sendToSinks base Online
2024-08-26T22:45:47.482 ktranslate/debug-level-test [Info] KTranslate monitorAlpha 0 Online
2024-08-26T22:45:47.482 ktranslate/debug-level-test [Info] stdoutSink Receiving logs...
2024-08-26T22:45:47.483 ktranslate/debug-level-test [Info] baseserver.metaserver Listening on 127.0.0.1:43881
2024-08-26T22:45:47.483 ktranslate/debug-level-test [Info] KTranslate monitorMetricsInput Starting
2024-08-26T22:45:47.484 ktranslate/debug-level-test [Info] KTranslate Turning off HTTP server.
2024-08-26T22:45:47.484 ktranslate/debug-level-test [Info] KTranslate do sendToKTranslate Starting
2024-08-26T22:45:47.482 ktranslate/debug-level-test [Info] KTranslate Loaded 1 Kentik devices via local file
2024-08-26T22:45:47.482 ktranslate/debug-level-test [Info] KTranslate System running with format flat_json, compression none, max flows: 10000, sample rate 1:1 after 1
2024-08-26T22:45:47.482 ktranslate/debug-level-test [Info] KTranslate sendToSinks base Online
2024-08-26T22:45:47.482 ktranslate/debug-level-test [Info] KTranslate monitorAlpha 0 Online
2024-08-26T22:45:47.482 ktranslate/debug-level-test [Info] stdoutSink Receiving logs...
2024-08-26T22:45:47.483 ktranslate/debug-level-test [Info] baseserver.metaserver Listening on 127.0.0.1:43881
2024-08-26T22:45:47.483 ktranslate/debug-level-test [Info] KTranslate monitorMetricsInput Starting
2024-08-26T22:45:47.484 ktranslate/debug-level-test [Info] KTranslate Turning off HTTP server.
2024-08-26T22:45:47.484 ktranslate/debug-level-test [Info] KTranslate do sendToKTranslate Starting
```

Even with debug logs supposedly enabled, I'm not seeing that Ktranslate is picking up the trap messages. I stripped out the stuff related to SNMP processing and ingesting data to New Relic, but can re-enable it if needed to see what gets sent to NRDB. This is what the `docker run` command typically looks like, and is what I used to launch the original container:
```
docker run -d --name ktranslate-debug-level-container --restart unless-stopped --pull=always -p 162:1620/udp \
-v `pwd`/traps-base.yaml:/snmp-base.yaml \
-e NEW_RELIC_API_KEY=$LICENSE_KEY \
kentik/ktranslate:v2 \
  -snmp /snmp-base.yaml \
  -nr_account_id=$ACCOUNT_ID \
  -metrics=jchf \
  -tee_logs=true \
  -service_name=debug-level-test \
  -snmp_discovery_on_start=true \
  -snmp_discovery_min=180 \
  -log_level=debug \
  nr1.snmp
```

**Comment by i3149** [comment]
> Sorry for the confusion on my end, but how are you checking the JSON that gets created by Ktranslat

I'm just removing `nr1.snmp`. By default things get dumped to json. 

From this, `-p 162:1620/udp` it looks like you are actually sending to port 162. Can you try again with removing the `nr1.snmp` line and see what happens? 

Thanks!

**Comment by jryburn** [comment]
@ASchneider-GitHub were to able to try Ian's suggestion to get the JSON output?

**Comment by ASchneider-GitHub** [comment]
Hi there @jryburn and @i3149. My apologies for the delay on responses, as I just got back to work from medical leave. I need to figure out where I left off with this and re-deploy my workspace. I'll get back to you as soon as I can with the results of the command

**Comment by ASchneider-GitHub** [comment]
Sorry for the wait. I got my environment set up and launched a container with:
```
docker run -d --name ktranslate-debug-level-container --restart unless-stopped --pull=always -p 162:1620/udp \
-v `pwd`/traps-base.yaml:/snmp-base.yaml \
-e NEW_RELIC_API_KEY=$LICENSE_KEY \
kentik/ktranslate:v2 \
  -snmp /snmp-base.yaml \
  -nr_account_id=$ACCOUNT_ID \
  -metrics=jchf \
  -tee_logs=true \
  -service_name=debug-level-test \
  -snmp_discovery_on_start=true \
  -snmp_discovery_min=180 \
  -log_level=debug
```

omitting the `nr1.snmp` argument so the payloads would be printed to the logs. I have debug mode enabled, so the logs are fairly long. This is what was logged (minus the timestamp and container name prefixing each message) when the trap script sent it's payload:

```
[Debug] KTranslate GoSNMP Trap:  Packet sanity verified, we got all the bytes (542)
[Debug] KTranslate GoSNMP Trap:  parseRawField: version
[Debug] KTranslate GoSNMP Trap:  Parsed version 1
[Debug] KTranslate GoSNMP Trap:  parseRawField: community
[Debug] KTranslate GoSNMP Trap:  Parsed community cdk
[Debug] KTranslate GoSNMP Trap:  UnmarshalPayload Meet PDUType 0xa7. Offset 12
[Debug] KTranslate GoSNMP Trap:  getResponseLength: 530
[Debug] KTranslate GoSNMP Trap:  parseRawField: request id
[Debug] KTranslate GoSNMP Trap:  requestID: 5927265
[Debug] KTranslate GoSNMP Trap:  parseRawField: error-status
[Debug] KTranslate GoSNMP Trap:  errorStatus: 0
[Debug] KTranslate GoSNMP Trap:  parseRawField: error index
[Debug] KTranslate GoSNMP Trap:  error-index: 0
[Debug] KTranslate GoSNMP Trap:  vblLength: 515
[Debug] KTranslate GoSNMP Trap:  parseRawField: OID
[Debug] KTranslate GoSNMP Trap:  OID: .1.3.6.1.2.1.1.3.0
[Debug] KTranslate GoSNMP Trap:decodeValue: type is TimeTicks
[Debug] KTranslate GoSNMP Trap:  decodeValue: value is 0xf534941
[Debug] KTranslate GoSNMP Trap:  parseRawField: OID
[Debug] KTranslate GoSNMP Trap:  OID: .1.3.6.1.6.3.1.1.4.1.0
[Debug] KTranslate GoSNMP Trap:decodeValue: type is ObjectIdentifier
[Debug] KTranslate GoSNMP Trap:  parseRawField: OID
[Debug] KTranslate GoSNMP Trap:  decodeValue: value is ".1.3.6.1.6.3.1.1.5.1"
[Debug] KTranslate GoSNMP Trap:  parseRawField: OID
[Debug] KTranslate GoSNMP Trap:  OID: .1.3.6.1.2.1.1.3.0
[Debug] KTranslate GoSNMP Trap:decodeValue: type is TimeTicks
[{"src_geo":"Private IP","instrumentation.name":"netflow-events","eventType":"KSnmpTrap","tags.container_service":"debug-level-test",".1.3.6.1.4.1.3375.2.4.1.3":"80",".1.3.6.1.4.1.3375.2.4.1.1":"Pool /Common/http_las.fml.prod.eleadcrm.com_80_pool member /Common/100.84.2.109:80 monitor status down. [ /Common/http_head_evo2-releaseinfo_200: down, /Common/http_release_updown: checking; last error: /Common/http_head_evo2-releaseinfo_200: Response Code: 200 (OK) @2024/08/14 09:10:15. ] [ was up for 0hr:3mins:36sec ]",".1.3.6.1.2.1.1.3.0":257116481,"collector.name":"ktranslate","device_name":"packet-replay-device","src_addr":"10.0.0.2","src_as_name":"Private IP","provider":"kentik-trap-device","TrapOID":".1.3.6.1.4.1.3375.2.4.0.10",".1.3.6.1.4.1.3375.2.4.1.2":"/Common/100.84.2.109","instrumentation.provider":"kentik",".1.3.6.1.6.3.1.1.4.3.0":".1.3.6.1.4.1.3375.2.4"}]
[Debug] KTranslate GoSNMP Trap:  decodeValue: value is 0xf534941
[Debug] KTranslate GoSNMP Trap:  parseRawField: OID
[Debug] KTranslate GoSNMP Trap:  OID: .1.3.6.1.6.3.1.1.4.1.0
[Debug] KTranslate GoSNMP Trap:decodeValue: type is ObjectIdentifier
[Debug] KTranslate GoSNMP Trap:  parseRawField: OID
[Debug] KTranslate GoSNMP Trap:  Packet sanity verified, we got all the bytes (542)
[Debug] KTranslate GoSNMP Trap:  parseRawField: version
[Debug] KTranslate GoSNMP Trap:  Parsed version 1
[Debug] KTranslate GoSNMP Trap:  parseRawField: community
[Debug] KTranslate GoSNMP Trap:  Parsed community cdk
[Debug] KTranslate GoSNMP Trap:  UnmarshalPayload Meet PDUType 0xa7. Offset 12
[Debug] KTranslate GoSNMP Trap:  getResponseLength: 530
[Debug] KTranslate GoSNMP Trap:  parseRawField: request id
[Debug] KTranslate GoSNMP Trap:  requestID: 5927265
[Debug] KTranslate GoSNMP Trap:  parseRawField: error-status
[Debug] KTranslate GoSNMP Trap:  errorStatus: 0
[Debug] KTranslate GoSNMP Trap:  parseRawField: error index
[Debug] KTranslate GoSNMP Trap:  error-index: 0
[Debug] KTranslate GoSNMP Trap:  vblLength: 515
[Debug] KTranslate GoSNMP Trap:  parseRawField: OID
[Debug] KTranslate GoSNMP Trap:  OID: .1.3.6.1.2.1.1.3.0
[Debug] KTranslate GoSNMP Trap:decodeValue: type is TimeTicks
[Debug] KTranslate GoSNMP Trap:  decodeValue: value is 0xf534941
[Debug] KTranslate GoSNMP Trap:  parseRawField: OID
[Debug] KTranslate GoSNMP Trap:  OID: .1.3.6.1.6.3.1.1.4.1.0
[Debug] KTranslate GoSNMP Trap:decodeValue: type is ObjectIdentifier
[Debug] KTranslate GoSNMP Trap:  parseRawField: OID
[Debug] KTranslate GoSNMP Trap:  decodeValue: value is ".1.3.6.1.6.3.1.1.5.1"
[Debug] KTranslate GoSNMP Trap:  decodeValue: value is ".1.3.6.1.4.1.3375.2.4.0.10"
[Debug] KTranslate GoSNMP Trap:  parseRawField: OID
[Debug] KTranslate GoSNMP Trap:  OID: .1.3.6.1.4.1.3375.2.4.1.1
[Debug] KTranslate GoSNMP Trap:decodeValue: type is OctetString
[Debug] KTranslate GoSNMP Trap:  decodeValue: value is []byte{0x50, 0x6f, 0x6f, 0x6c, 0x20, 0x2f, 0x43, 0x6f, 0x6d, 0x6d, 0x6f, 0x6e, 0x2f, 0x68, 0x74, 0x74, 0x70, 0x5f, 0x6c, 0x61, 0x73, 0x2e, 0x66, 0x6d, 0x6c, 0x2e, 0x70, 0x72, 0x6f, 0x64, 0x2e, 0x65, 0x6c, 0x65, 0x61, 0x64, 0x63, 0x72, 0x6d, 0x2e, 0x63, 0x6f, 0x6d, 0x5f, 0x38, 0x30, 0x5f, 0x70, 0x6f, 0x6f, 0x6c, 0x20, 0x6d, 0x65, 0x6d, 0x62, 0x65, 0x72, 0x20, 0x2f, 0x43, 0x6f, 0x6d, 0x6d, 0x6f, 0x6e, 0x2f, 0x31, 0x30, 0x30, 0x2e, 0x38, 0x34, 0x2e, 0x32, 0x2e, 0x31, 0x30, 0x39, 0x3a, 0x38, 0x30, 0x20, 0x6d, 0x6f, 0x6e, 0x69, 0x74, 0x6f, 0x72, 0x20, 0x73, 0x74, 0x61, 0x74, 0x75, 0x73, 0x20, 0x64, 0x6f, 0x77, 0x6e, 0x2e, 0x20, 0x5b, 0x20, 0x2f, 0x43, 0x6f, 0x6d, 0x6d, 0x6f, 0x6e, 0x2f, 0x68, 0x74, 0x74, 0x70, 0x5f, 0x68, 0x65, 0x61, 0x64, 0x5f, 0x65, 0x76, 0x6f, 0x32, 0x2d, 0x72, 0x65, 0x6c, 0x65, 0x61, 0x73, 0x65, 0x69, 0x6e, 0x66, 0x6f, 0x5f, 0x32, 0x30, 0x30, 0x3a, 0x20, 0x64, 0x6f, 0x77, 0x6e, 0x2c, 0x20, 0x2f, 0x43, 0x6f, 0x6d, 0x6d, 0x6f, 0x6e, 0x2f, 0x68, 0x74, 0x74, 0x70, 0x5f, 0x72, 0x65, 0x6c, 0x65, 0x61, 0x73, 0x65, 0x5f, 0x75, 0x70, 0x64, 0x6f, 0x77, 0x6e, 0x3a, 0x20, 0x63, 0x68, 0x65, 0x63, 0x6b, 0x69, 0x6e, 0x67, 0x3b, 0x20, 0x6c, 0x61, 0x73, 0x74, 0x20, 0x65, 0x72, 0x72, 0x6f, 0x72, 0x3a, 0x20, 0x2f, 0x43, 0x6f, 0x6d, 0x6d, 0x6f, 0x6e, 0x2f, 0x68, 0x74, 0x74, 0x70, 0x5f, 0x68, 0x65, 0x61, 0x64, 0x5f, 0x65, 0x76, 0x6f, 0x32, 0x2d, 0x72, 0x65, 0x6c, 0x65, 0x61, 0x73, 0x65, 0x69, 0x6e, 0x66, 0x6f, 0x5f, 0x32, 0x30, 0x30, 0x3a, 0x20, 0x52, 0x65, 0x73, 0x70, 0x6f, 0x6e, 0x73, 0x65, 0x20, 0x43, 0x6f, 0x64, 0x65, 0x3a, 0x20, 0x32, 0x30, 0x30, 0x20, 0x28, 0x4f, 0x4b, 0x29, 0x20, 0x40, 0x32, 0x30, 0x32, 0x34, 0x2f, 0x30, 0x38, 0x2f, 0x31, 0x34, 0x20, 0x30, 0x39, 0x3a, 0x31, 0x30, 0x3a, 0x31, 0x35, 0x2e, 0x20, 0x5d, 0x20, 0x5b, 0x20, 0x77, 0x61, 0x73, 0x20, 0x75, 0x70, 0x20, 0x66, 0x6f, 0x72, 0x20, 0x30, 0x68, 0x72, 0x3a, 0x33, 0x6d, 0x69, 0x6e, 0x73, 0x3a, 0x33, 0x36, 0x73, 0x65, 0x63, 0x20, 0x5d}
[Debug] KTranslate GoSNMP Trap:  parseRawField: OID
[Debug] KTranslate GoSNMP Trap:  OID: .1.3.6.1.4.1.3375.2.4.1.2
[Debug] KTranslate GoSNMP Trap:decodeValue: type is OctetString
[Debug] KTranslate GoSNMP Trap:  decodeValue: value is []byte{0x2f, 0x43, 0x6f, 0x6d, 0x6d, 0x6f, 0x6e, 0x2f, 0x31, 0x30, 0x30, 0x2e, 0x38, 0x34, 0x2e, 0x32, 0x2e, 0x31, 0x30, 0x39}
[Debug] KTranslate GoSNMP Trap:  parseRawField: OID
[Debug] KTranslate GoSNMP Trap:  OID: .1.3.6.1.4.1.3375.2.4.1.3
[Debug] KTranslate GoSNMP Trap:decodeValue: type is OctetString
[Debug] KTranslate GoSNMP Trap:  decodeValue: value is []byte{0x38, 0x30}
[Debug] KTranslate GoSNMP Trap:  parseRawField: OID
[Debug] KTranslate GoSNMP Trap:  OID: .1.3.6.1.6.3.1.1.4.3.0
[Debug] KTranslate GoSNMP Trap:decodeValue: type is ObjectIdentifier
[Debug] KTranslate GoSNMP Trap:  parseRawField: OID
[Debug] KTranslate GoSNMP Trap:  decodeValue: value is ".1.3.6.1.4.1.3375.2.4"
[Info] KTranslate got trapdata from 10.0.0.2, EngineID
[Debug] KTranslate GoSNMP Trap:  parseRawField: OID
[Debug] KTranslate GoSNMP Trap:  OID: .1.3.6.1.2.1.1.3.0
[Debug] KTranslate GoSNMP Trap:decodeValue: type is TimeTicks
[Debug] KTranslate GoSNMP Trap:  decodeValue: value is 0xf534941
[Debug] KTranslate GoSNMP Trap:  parseRawField: OID
[Debug] KTranslate GoSNMP Trap:  OID: .1.3.6.1.6.3.1.1.4.1.0
[Debug] KTranslate GoSNMP Trap:decodeValue: type is ObjectIdentifier
[Debug] KTranslate GoSNMP Trap:  parseRawField: OID
[Debug] KTranslate GoSNMP Trap:  decodeValue: value is ".1.3.6.1.4.1.3375.2.4.0.10"
[Debug] KTranslate GoSNMP Trap:  parseRawField: OID
[Debug] KTranslate GoSNMP Trap:  OID: .1.3.6.1.4.1.3375.2.4.1.1
[Debug] KTranslate GoSNMP Trap:decodeValue: type is OctetString
[Debug] KTranslate GoSNMP Trap:  decodeValue: value is []byte{0x50, 0x6f, 0x6f, 0x6c, 0x20, 0x2f, 0x43, 0x6f, 0x6d, 0x6d, 0x6f, 0x6e, 0x2f, 0x68, 0x74, 0x74, 0x70, 0x5f, 0x6c, 0x61, 0x73, 0x2e, 0x66, 0x6d, 0x6c, 0x2e, 0x70, 0x72, 0x6f, 0x64, 0x2e, 0x65, 0x6c, 0x65, 0x61, 0x64, 0x63, 0x72, 0x6d, 0x2e, 0x63, 0x6f, 0x6d, 0x5f, 0x38, 0x30, 0x5f, 0x70, 0x6f, 0x6f, 0x6c, 0x20, 0x6d, 0x65, 0x6d, 0x62, 0x65, 0x72, 0x20, 0x2f, 0x43, 0x6f, 0x6d, 0x6d, 0x6f, 0x6e, 0x2f, 0x31, 0x30, 0x30, 0x2e, 0x38, 0x34, 0x2e, 0x32, 0x2e, 0x31, 0x30, 0x39, 0x3a, 0x38, 0x30, 0x20, 0x6d, 0x6f, 0x6e, 0x69, 0x74, 0x6f, 0x72, 0x20, 0x73, 0x74, 0x61, 0x74, 0x75, 0x73, 0x20, 0x64, 0x6f, 0x77, 0x6e, 0x2e, 0x20, 0x5b, 0x20, 0x2f, 0x43, 0x6f, 0x6d, 0x6d, 0x6f, 0x6e, 0x2f, 0x68, 0x74, 0x74, 0x70, 0x5f, 0x68, 0x65, 0x61, 0x64, 0x5f, 0x65, 0x76, 0x6f, 0x32, 0x2d, 0x72, 0x65, 0x6c, 0x65, 0x61, 0x73, 0x65, 0x69, 0x6e, 0x66, 0x6f, 0x5f, 0x32, 0x30, 0x30, 0x3a, 0x20, 0x64, 0x6f, 0x77, 0x6e, 0x2c, 0x20, 0x2f, 0x43, 0x6f, 0x6d, 0x6d, 0x6f, 0x6e, 0x2f, 0x68, 0x74, 0x74, 0x70, 0x5f, 0x72, 0x65, 0x6c, 0x65, 0x61, 0x73, 0x65, 0x5f, 0x75, 0x70, 0x64, 0x6f, 0x77, 0x6e, 0x3a, 0x20, 0x63, 0x68, 0x65, 0x63, 0x6b, 0x69, 0x6e, 0x67, 0x3b, 0x20, 0x6c, 0x61, 0x73, 0x74, 0x20, 0x65, 0x72, 0x72, 0x6f, 0x72, 0x3a, 0x20, 0x2f, 0x43, 0x6f, 0x6d, 0x6d, 0x6f, 0x6e, 0x2f, 0x68, 0x74, 0x74, 0x70, 0x5f, 0x68, 0x65, 0x61, 0x64, 0x5f, 0x65, 0x76, 0x6f, 0x32, 0x2d, 0x72, 0x65, 0x6c, 0x65, 0x61, 0x73, 0x65, 0x69, 0x6e, 0x66, 0x6f, 0x5f, 0x32, 0x30, 0x30, 0x3a, 0x20, 0x52, 0x65, 0x73, 0x70, 0x6f, 0x6e, 0x73, 0x65, 0x20, 0x43, 0x6f, 0x64, 0x65, 0x3a, 0x20, 0x32, 0x30, 0x30, 0x20, 0x28, 0x4f, 0x4b, 0x29, 0x20, 0x40, 0x32, 0x30, 0x32, 0x34, 0x2f, 0x30, 0x38, 0x2f, 0x31, 0x34, 0x20, 0x30, 0x39, 0x3a, 0x31, 0x30, 0x3a, 0x31, 0x35, 0x2e, 0x20, 0x5d, 0x20, 0x5b, 0x20, 0x77, 0x61, 0x73, 0x20, 0x75, 0x70, 0x20, 0x66, 0x6f, 0x72, 0x20, 0x30, 0x68, 0x72, 0x3a, 0x33, 0x6d, 0x69, 0x6e, 0x73, 0x3a, 0x33, 0x36, 0x73, 0x65, 0x63, 0x20, 0x5d}
[Debug] KTranslate GoSNMP Trap:  parseRawField: OID
[Debug] KTranslate GoSNMP Trap:  OID: .1.3.6.1.4.1.3375.2.4.1.2
[Debug] KTranslate GoSNMP Trap:decodeValue: type is OctetString
[Debug] KTranslate GoSNMP Trap:  decodeValue: value is []byte{0x2f, 0x43, 0x6f, 0x6d, 0x6d, 0x6f, 0x6e, 0x2f, 0x31, 0x30, 0x30, 0x2e, 0x38, 0x34, 0x2e, 0x32, 0x2e, 0x31, 0x30, 0x39}
[Debug] KTranslate GoSNMP Trap:  parseRawField: OID
[Debug] KTranslate GoSNMP Trap:  OID: .1.3.6.1.4.1.3375.2.4.1.3
[Debug] KTranslate GoSNMP Trap:decodeValue: type is OctetString
[Debug] KTranslate GoSNMP Trap:  decodeValue: value is []byte{0x38, 0x30}
[Debug] KTranslate GoSNMP Trap:  parseRawField: OID
[Debug] KTranslate GoSNMP Trap:  OID: .1.3.6.1.6.3.1.1.4.3.0
[Debug] KTranslate GoSNMP Trap:decodeValue: type is ObjectIdentifier
[Debug] KTranslate GoSNMP Trap:  parseRawField: OID
[Debug] KTranslate GoSNMP Trap:  decodeValue: value is ".1.3.6.1.4.1.3375.2.4"
[Info] KTranslate got trapdata from 10.0.0.2, EngineID
```

The JSON payload that I'm seeing is on line 27:
```json
[
  {
    "src_geo": "Private IP",
    "instrumentation.name": "netflow-events",
    "eventType": "KSnmpTrap",
    "tags.container_service": "debug-level-test",
    ".1.3.6.1.4.1.3375.2.4.1.3": "80",
    ".1.3.6.1.4.1.3375.2.4.1.1": "Pool /Common/http_las.fml.prod.eleadcrm.com_80_pool member /Common/100.84.2.109:80 monitor status down. [ /Common/http_head_evo2-releaseinfo_200: down, /Common/http_release_updown: checking; last error: /Common/http_head_evo2-releaseinfo_200: Response Code: 200 (OK) @2024/08/14 09:10:15. ] [ was up for 0hr:3mins:36sec ]",
    ".1.3.6.1.2.1.1.3.0": 257116481,
    "collector.name": "ktranslate",
    "device_name": "packet-replay-device",
    "src_addr": "10.0.0.2",
    "src_as_name": "Private IP",
    "provider": "kentik-trap-device",
    "TrapOID": ".1.3.6.1.4.1.3375.2.4.0.10",
    ".1.3.6.1.4.1.3375.2.4.1.2": "/Common/100.84.2.109",
    "instrumentation.provider": "kentik",
    ".1.3.6.1.6.3.1.1.4.3.0": ".1.3.6.1.4.1.3375.2.4"
  }
]
```

It looks like the varbinds are still showing their OIDs for the field name instead of the expected translation (e.g. `1.3.6.1.4.1.3375.2.4.1.2` instead of `node_name`.

Any changes that you would recommend making before testing again? It seems like Ktranslate is correctly identifying the varbinds exist and can see the values, but I don't see any attempts to translate the varbind OID into a string.
